2153,286210: FWM 2 Offline Technologies Design,"This is work specifically directed at offline functionalities and the expertise to produce functionality and support infrastructure using SQL Anywhere, Afaria, and Mobilink. This includes design for code, on device databases, server structure, and security considerations.",Key Deliverable,2010-11-02,2011-04-22,0.142,0.142,0.142,Completed - Closed,1,02/23/2012,9266,171 days,171 days,0 days
2153,286210: FWM 2 Offline Technologies Development,"This is work specifically directed at offline functionalities and the expertise to produce functionality and support infrastructure using SQL Anywhere, Afaria, and Mobilink. This includes development for RADs and infrastructure.",Usable Functionality,2011-04-11,2011-09-26,0.2,0.208,0.208,Completed - Closed,1,02/23/2012,9267,168 days,168 days,0 days
2153,286210: FMM 2 Offline Technologies Test,"This is work specifically directed at offline functionalities and the expertise to produce functionality and support infrastructure using SQL Anywhere, Afaria, and Mobilink. This includes functional testing for all aspects of offline functionality.",Usable Functionality,2011-07-20,2011-09-26,0.081,0.11,0.084,Completed - Closed,1,02/23/2012,9268,68 days,68 days,0 days
2154,286212: EM Business Requirements ,This gathered requirements for Entry Query business considerations.,Key Deliverable,2010-09-27,2011-01-17,0.268,0.268,0.268,Completed - Closed,1,02/23/2012,9272,112 days,112 days,0 days
2154,"286212: EM Functional, Non Functional, and User Interface Requirements","This gathered requirements for Entry Query functionality, user interface, and non functional considerations.",Key Deliverable,2011-01-18,2011-05-25,0.367,0.367,0.367,Completed - Closed,1,02/23/2012,9273,127 days,127 days,0 days
2154,286212: EM Preliminary Design,This produced a preliminary design for Entry Query functionality within EM.,Key Deliverable,2011-01-03,2011-07-13,0.357,0.357,0.357,Completed - Closed,1,02/23/2012,9275,191 days,161 days,37 days
2154,286212: EM Final Design,This produced a final design for Entry Query functionality within EM.,Key Deliverable,2011-05-27,2011-10-28,0.212,0.219,0.219,Completed - Closed,1,02/23/2012,9276,154 days,100 days,54 days
2154,286212: EM Development,This is producing some of the Entry Query functionality.  The rest will be produced later once more functionality from OASIS and Entry Review has been migrated to EM.  This is due to technical dependences.,Usable Functionality,2011-06-14,2011-11-04,0.538,0.483,,In-progress,1,02/23/2012,9277,143 days,,49 days
2154,286212: EM Test,This will conduct unit and regression testing on some of the Entry Query functionality.,Usable Functionality,2011-06-27,2011-11-18,0.251,2.184,,In-progress,1,02/23/2012,9278,144 days,,77 days
2154,286212: EM Field Exam and Sample Collection Requirements,This is for gathering requirements for the field exam and sample collection functionality that exists in OASIS that will be migrated to FWM and WAAM.,Key Deliverable,2011-03-01,2011-08-31,0.255,0.255,0.255,Completed - Closed,1,02/23/2012,9279,183 days,183 days,0 days
2155,286215: PREDICT ETL for Control Agents and Database Connections,This is focused on improving the ETL that is currently in place.  This will provide faster and more reliable data transfer.,Usable Functionality,2010-09-29,2011-01-07,0.19,0.232,0.232,Completed - Closed,1,02/23/2012,9282,100 days,105 days,0 days
2155,286215: PREDICT ETL for Test and Documentation,This is focused on improving the ETL that is currently in place.  This will provide faster and more reliable data transfer.,Usable Functionality,2011-02-14,2011-07-22,0.075,0.075,0.075,Completed - Closed,1,02/23/2012,9283,158 days,158 days,0 days
2155,286215: PREDICT DnB Requirements and Design,"FDA is developing the capability to access and leverage the extensive world wide database that DnB has for firm information. This will help to standardize how firms are identified and tracked within FDA. This is especially useful when dealing foreign firms where names need to be transliterated from non Latin alphabets. This transliteration has historically introduced errors in firm information. Improved quality in firm information will help make PREDICT and import screening for 801(a) more effective. This will help FDA process the 20,000,000+ products that are imported each year.",Usable Functionality,2011-01-10,2011-06-03,0.175,0.175,0.175,Completed - Closed,1,02/23/2012,9285,144 days,157 days,0 days
2155,286215: PREDICT DnB Development and Test,"FDA is developing the capability to access and leverage the extensive world wide database that DnB has for firm information. This will help to standardize how firms are identified and tracked within FDA. This is especially useful when dealing foreign firms where names need to be transliterated from non Latin alphabets. This transliteration has historically introduced errors in firm information. Improved quality in firm information will help make PREDICT and import screening for 801(a) more effective. This will help FDA process the 20,000,000+ products that are imported each year.",Usable Functionality,2011-03-25,2011-08-18,0.045,0.045,0.045,Completed - Closed,1,02/23/2012,9286,146 days,146 days,0 days
2155,286215: PREDICT Rules Studio,"This includes requirements, design, and some development for Rules Studio. Currently, when rules for PREDICT need to be modified, added, or removed, technical contract personnel need to make these modifications. This is to produce functionality that will allow non technical FTEs to make these modifications, additions, or deletions.",Key Deliverable,2011-04-28,2011-09-28,0.192,0.204,0.174,Completed - Closed,1,02/23/2012,9287,153 days,153 days,0 days
2156,286216: DGS Requirements for DGS,This gathered requirements for DGS functionality for MARCS.,Key Deliverable,2010-09-27,2011-02-14,0.253,0.253,0.253,Completed - Closed,1,02/23/2012,9290,140 days,140 days,0 days
2156,286216: DGS Requirements for Integration with QMiS,This gathered requirements for integration with Automated Laboratory Management (ALM) Quality Management Information System (QMiS),Key Deliverable,2011-06-06,2011-08-05,0.06,0.06,0.06,Completed - Closed,1,02/23/2012,9291,60 days,60 days,0 days
2156,286216: DGS Decision Analysis,An industry survey and analysis of COTS products was conducted.  This resulted in a recommended product to implement the functionality envisioned for DGS.,Key Deliverable,2010-10-20,2011-03-08,0.135,0.135,0.135,Completed - Closed,1,02/23/2012,9292,139 days,139 days,0 days
2156,286216: DGS Preliminary Design,This produced a preliminary design for DGS.,Key Deliverable,2011-01-31,2011-04-28,0.288,0.288,0.288,Completed - Closed,1,02/23/2012,9294,87 days,87 days,0 days
2156,286216: DGS Final Design,This produced a final design for DGS.,Key Deliverable,2011-04-29,2011-08-17,0.123,0.123,0.123,Completed - Closed,1,02/23/2012,9295,110 days,110 days,0 days
2156,286216: DGS Development,This is producing code that realizes the DGS functionality using a COTS and some custom code.,Usable Functionality,2011-04-22,2011-08-29,0.357,0.362,0.362,Completed - Closed,1,02/23/2012,9296,129 days,189 days,0 days
2156,286216: DGS Test ,This is for conducting unit and regression testing on DGS functionality.,Usable Functionality,2011-05-25,2011-09-26,0.078,0.091,0.069,Completed - Closed,1,02/23/2012,9297,124 days,168 days,0 days
2157,286217: WAAM 2 RAC Requirements Validation,"RAC requirements were gathered in WAAM, but these requirements needed to be verified in relation to the use of the legacy Recall Enterprise System (RES) for supporting the work of ORA Field users.",Key Deliverable,2010-09-27,2010-11-15,0.081,0.081,0.081,Completed - Closed,1,02/23/2012,9300,49 days,49 days,0 days
2157,286217: WAAM 2 RAC Design for User Interface and Logical,This produced a design for WAAM that supports RAC functionality and also includes considerations for the future work management in relation to other types of Field activities for user interfaces and logical software and data considerations.,Key Deliverable,2010-11-02,2011-03-31,0.101,0.128,0.128,Completed - Closed,1,02/23/2012,9302,149 days,149 days,0 days
2157,286217: WAAM 2 RAC Design for Services Specifications,This produced a design for WAAM that supports RAC functionality and also includes considerations for the future work management in relation to other types of Field activities.  This took into account functionality that will be needed from the various MARCS services.,Key Deliverable,2011-03-04,2011-05-11,0.048,0.092,0.092,Completed - Closed,1,02/23/2012,9303,68 days,68 days,0 days
2157,"286217: WAAM 2 RAC Design for Physical Data, Security, Interface, and Data Synchronization","This produced a design for WAAM that supports RAC functionality and also includes considerations for the future work management in relation to other types of Field activities. This took into account the physical data design, security ramifications, interface specifications, and considerations for migrating data.",Key Deliverable,2011-05-11,2011-06-08,0.062,0.11,0.11,Completed - Closed,1,02/23/2012,9304,28 days,28 days,0 days
2157,286217: WAAM 2 RAC Development and Support for FWM and eSAF,This produced code to realize RAC functionality that will support work flows realized in Field Work Manager (FWM) and the legacy Electronic State Access to FACTS (eSAF),Usable Functionality,2010-11-02,2011-06-08,0.208,0.356,0.356,Completed - Closed,1,02/23/2012,9306,162 days,247 days,0 days
2157,286217: WAAM 2 RAC Development and Support for RES,This produced code to realize RAC functionality that will support work flows realized in the legacy Recall Enterprise System (RES).,Usable Functionality,2011-03-31,2011-07-22,0.127,0.448,0.448,Completed - Closed,1,02/23/2012,9307,113 days,179 days,0 days
2157,286217: WAAM 2 RAC Test,This is for conducting unit and regression testing for RAC functionality. ,Usable Functionality,2011-02-09,2011-07-31,0.145,0.219,0.195,Completed - Closed,1,02/23/2012,9308,172 days,229 days,0 days
2157,286217: WAAM 2 Inspections Requirements,This produced requirements documentation.  One of the goals is to increase the use of fielded data to eliminate redundant data entry and improve searching and reporting capabilities.,Key Deliverable,2010-10-13,2011-03-09,0.165,0.165,0.165,Completed - Closed,1,02/23/2012,9310,147 days,147 days,0 days
2157,286217: WAAM 2 Inspections Design for User Interface and Logical,This produced a design for WAAM that supports Inspections functionality and also includes considerations for the future work management in relation to other types of Field activities for user interfaces and logical software and data considerations.,Key Deliverable,2011-02-18,2011-08-16,0.102,0.117,0.117,Completed - Closed,1,02/23/2012,9312,179 days,179 days,0 days
2157,286217: WAAM 2 Inspections Design for Services Specifications,This produced a design for WAAM that supports Inspections functionality and also includes considerations for the future work management in relation to other types of Field activities. This took into account functionality that will be needed from the various MARCS services.,Key Deliverable,2011-04-18,2011-09-06,0.033,0.032,0.032,Completed - Closed,1,02/23/2012,9313,141 days,161 days,0 days
2157,"286217: WAAM 2 Inspections Design for Physical Data, Security, Interfaces, and Data Synchronization","This produced a design for WAAM that supports Inspections functionality and also includes considerations for the future work management in relation to other types of Field activities. This took into account the physical data design, security ramifications, interface specifications, and considerations for migrating data.",Key Deliverable,2011-08-24,2011-09-13,0.069,0.07,0.07,Completed - Closed,1,02/23/2012,9314,20 days,33 days,0 days
2157,286217: WAAM 2 Inspections Development Iterations 1 and 2,"MARCS uses an iterative approach to development. For Inspections, four iterations were used to build out functionality, verify that it is correct, and then expand on that functionality. This is the first two of those iterations.",Usable Functionality,2010-11-02,2011-04-04,0.167,0.147,0.147,Completed - Closed,1,02/23/2012,9316,153 days,182 days,0 days
2157,286217: WAAM 2 Inspections Development Iterations 3 and 4,"MARCS uses an iterative approach to development. For Inspections, four iterations were used to build out functionality, verify that it is correct, and then expand on that functionality. This is the second two of those iterations.",Usable Functionality,2011-04-05,2011-09-20,0.215,0.243,0.133,Completed - Closed,1,02/23/2012,9317,168 days,131 days,43 days
2157,286217: WAAM 2 Inspections Test,This is for conducting unit and regression testing for Inspections functionality.,Usable Functionality,2011-04-05,2011-09-26,0.082,0.357,0.017,Completed - Closed,1,02/23/2012,9318,174 days,131 days,43 days
2157,286217: WAAM 2 Import Field Exams Business Requirements ,This is to gather business requirements for Import Field Exams. This focused on migrating and enhancing current functionality. It also included an examination of import and domestic field examination types to determine where terminology and method could be appropriately shared between the two.,Key Deliverable,2010-10-15,2011-02-04,0.061,0.054,0.054,Completed - Closed,1,02/23/2012,9321,112 days,172 days,0 days
2157,286217: WAAM 2 Import Field Exams Functional Requirements,This is to gather functional requirements for Import Field Exams,Key Deliverable,2011-02-07,2011-04-15,0.033,0.027,0.027,Completed - Closed,1,02/23/2012,9322,67 days,155 days,0 days
2157,286217: WAAM 2 Import Field Exams Non Functional and User Interface Requirements,This is to gather non functional and user interface requirements for Field Exams.,Key Deliverable,2011-07-07,2011-08-31,0.045,0.078,0.006,Completed - Closed,1,02/23/2012,9323,55 days,81 days,0 days
2157,286217: WAAM 2 Import Field Exams Design,This produced a design for WAAM that supports Import Field Exams functionality and also includes considerations for the Domestic Field Exams.,Key Deliverable,2011-06-15,2011-09-26,0.091,0.097,0.074,Completed - Closed,1,02/23/2012,9324,103 days,103 days,0 days
2157,286217: WAAM 2 Import Field Exams Development,This produced code to realize Import Field Exam functionality.,Usable Functionality,2011-05-09,2011-09-26,0.121,0.156,0.042,Completed - Closed,1,02/23/2012,9325,140 days,140 days,0 days
2157,286217: WAAM 2 Import Field Exams Test,This is for conducting unit and regression testing for Import Field Exam functionality.,Usable Functionality,2011-08-15,2011-09-26,0.037,0.13,0.01,Completed - Closed,1,02/23/2012,9326,42 days,42 days,0 days
2157,286217: WAAM 2 Work Planner Business Requirements,"One of the challenges faced by ORA is typing work performed correctly. There are a number of existing categories for work, but sometimes the definitions of these are not clear. There are also a number of situations that arise where someone performing Field work could classify that work in different ways using the current work taxonomy. This was addressed in this requirements gathering in order to make it more intuitive for Field users to classify their work according to what they actually do and give the ORA management structure the ability to plan work and pull reports.",Key Deliverable,2011-01-13,2011-06-29,0.051,0.032,0.032,Completed - Closed,1,02/23/2012,9329,167 days,167 days,0 days
2157,"286217: WAAM 2 Work Planner Functional, Non Functional, and User Interface Requirements",This is to gather requirements for building Work Planner.,Key Deliverable,2011-07-01,2011-08-11,0.036,0.023,0.023,Completed - Closed,1,02/23/2012,9330,41 days,41 days,0 days
2157,286217: WAAM 2 Work Planner Design for User Interface and Logical,This produced a design for WAAM that supports Work Planner for the annual plan for user interfaces and logical software and data considerations.,Key Deliverable,2011-02-22,2011-05-26,0.032,0.027,0.027,Completed - Closed,1,02/23/2012,9332,93 days,93 days,0 days
2157,286217: WAAM 2 Work Planner Design for Services Specifications,This produced a design for WAAM that supports Work Planner for the annual plan. This took into account functionality that will be needed from the various MARCS services.,Key Deliverable,2011-05-26,2011-08-25,0.024,0.02,0.02,Completed - Closed,1,02/23/2012,9333,91 days,91 days,0 days
2157,"286217: WAAM 2 Work Planner Design for Physical Data, Security, Interfaces, and Data Synchronization","This produced a design for WAAM that supports Work Planner for the annual plan. This took into account the physical data design, security ramifications, interface specifications, and considerations for migrating data.",Key Deliverable,2011-06-07,2011-09-15,0.103,0.111,0.077,Completed - Closed,1,02/23/2012,9334,100 days,111 days,0 days
2157,286217: WAAM 2 Work Planner Development,This produced code to realize Work Planner functionality.,Key Deliverable,2011-04-04,2011-09-23,0.167,0.284,0.045,Completed - Closed,1,02/23/2012,9335,172 days,175 days,0 days
2157,286217: WAAM 2 Work Planner Test,This is for conducting unit and regression testing for Work Planner functionality.,Key Deliverable,2011-07-19,2011-09-26,0.078,0.247,0.019,Completed - Closed,1,02/23/2012,9336,69 days,69 days,0 days
2157,"286217: WAAM 2 Domestic Field Exams, Sample Collection, National Sample Distributor, and Other Business Requirements",WAAM will need to support all of the regulatory work flows in ORA since it will be the hub of work within MARCS. This is to start collecting requirements for these future work types. This is for business related requirements that often deal with how to standardize procedures and approaches amongst different organizational units.,Key Deliverable,2010-10-08,2011-02-17,0.145,0.125,0.125,Completed - Closed,1,02/23/2012,9338,132 days,132 days,0 days
2157,"286217: WAAM 2 Domestic Field Exams, Sample Collection, National Sample Distributor, and Other Functional, Non Functional, and User Interface Requirements",WAAM will need to support all of the regulatory work flows in ORA since it will be the hub of work within MARCS. This is to start collecting requirements for these future work types. This is to gather requirements for realizing functionality.,Key Deliverable,2011-04-27,2011-09-20,0.113,0.097,0.097,Completed - Closed,1,02/23/2012,9339,146 days,152 days,0 days
2163,286294: Imports 2 FY12H1,"This represents preliminary high-level schedule activity and cost estimates.  As further details are developed, the following scope will be broken out into detailed activities, dates, and cost estimates. This is the first six months of Imports 2 and includes the following. Imports 2 will contain work for Entry Manager (EM), Import Trade Auxiliary Communications System (ITACS), Predictive Rick-based Evaluation and Dynamic Import Compliance Targeting (PREDICT), Prior Notice Manager (PNM), and Customs System Interface (CSI). For EM, this will focus on migrating functionality from the legacy systems Operational and Administrate System for Import Support (OASIS) and Entry Review to support 801(a) screening. For ITACS, this will focus on account management (via Authorization, Roles, and Responsibilities Management Services (ARRMS)) and additional functionality enabled by logins. For PREDICT, this will focus on building functionality to better manage rules. For PNM and CSI, this will focus on requirements. EM will provide functionality for screening, in conjunction with PREDICT, for the majority of the 20,000,000+ products imported via the 801(a) process annually. This will give import screeners and import compliance officers a unified interface for dealing with all of their work flows, including tracking Field Work (accomplished in Field Work Manager (FWM)). PREDICT is an expert system built around a rules engine that produces a risk-based score of imported products. Products with a low score are automatically sent forward by PREDICT. Products with a higher score require an import screener to review the product by using EM. ITACS is used to interface with import filers and industry to provide a conduit for supporting documentation. This will reduce the current use of phone calls and emails, provide FDA with a more reliable information source and record, and give industry a more efficient way of communicating. Use of this component by industry is voluntary, so it must provide an incentive for external partners. PNM will provide the interface for work flows associated with 801(m) import screening, Prior Notice, which is focused on Food Security and Food Safety. This will replace functionality currently in OASIS. CSI will replace the outdated technology currently used for the interface between FDA and Customs and Border Protection (CBP). Work on CSI is dependent upon and must be done in conjunction with CBP so as to accommodate CBP modifications and enhancements. ",Usable Functionality,2011-09-23,2012-03-22,1.813,2.442,,In-progress,1,02/23/2012,9355,181 days,,0 days
2167,286298: Software Acquisition for Oracle Technologies Parent Activity,"This is a software acquisition of COTS technologies. This includes an expansion of the licenses for the BPMS (Business Process Management Suite) (including Enterprise Service Bus (ESB) and Service Oriented Architecture (SOA)), Oracle Identity Management (IDM) Suite, WebCenter, Oracle Policy Automation (OPA), and Real User Experience Insight (RUEI). The license expansion for the BPMS includes enough licenses for all FDA users. A number of FDA Centers have expressed interest in using this platform for their systems. MARCS has a primary focus on integration across the organization and as the BPMS would help further this goal, these licenses have been expanded to enable organization wide integration. IDM will give MARCS a comprehensive COTS solution to provide the specialized functionality and fine grained security control envisioned. This will require some custom code to realize envisioned functionality. The custom code will be developed under Authorization, Roles, and Responsibilities Management Services (ARRMS) 2 - Supplemental. IDM may also be leveraged as an FDA wide solution in the future. The implementation of IDM will be used by every component within MARCS. This has been vetted with the FDA CIO and HHS CIO and conforms to HHS standard security. WebCenter provides robust user interface and portal capabilities. This COTS will be used to implement User Workspace Enhancement Services (UWES), which is part of the Support Services project. UWES will provide a standardized user experience customized based on user role and single user preferences. OPA is a rules engine that will have a number of applications in MARCS ranging from inspection preparation, intelligent questionnaires, and import screening support. RUEI is a tool that can be used from a centralized location to determine the experience that an end user at a remote site is having. ORA is a geographically dispersed organization. In this sense, the user community for MARCS is different from Center user communities since the vast majority of users are not in the Washington, DC metropolitan area. This tool will give ORA and OIM a new ability to understand what is actually happening at user sites and will enable a systematic approach towards improving performance and reliability in the Field. The software acquired will be used in all of the MARCS projects going forward to one degree or another and will enable MARCS functionality that will be realized in releases.",Key Deliverable,2011-08-04,2011-09-30,4.856,4.856,4.856,Completed - Closed,1,02/23/2012,9364,57 days,57 days,0 days
2168,287489: LIMS Proof of Concept Analysis,"This focused on conducting an analysis of current manual work flows involving the use of the 431 form in ORA laboratories. This form is used by bench analysts to record the actions taken during sample analyses. Data is hand written onto this form. Once complete, the data is manually entered into the legacy MARCS Field Accomplishments and Compliance Tracking System (FACTS). This is an outdated approach to collecting this data and results in a good amount of analyst time being spent on filling out this form and entering data rather than conducting lab work. The analysis looked at ways to approach making this form electronic.",Key Deliverable,2009-10-01,2009-12-15,0.032,0.031,0.031,Completed - Closed,1,02/24/2012,9366,75 days,75 days,0 days
2168,287489: LIMS Proof of Concept Phase 1,Based on the results of the analysis it was determined that the most general approach to handling this information was to build a set of forms using FileMaker Pro for use on both tablet laptops and a handheld device. The tablet laptops may be placed on small mobile carts which can be wheeled to various locations within a static laboratory in a building. The handheld device can be used in static laboratories and also in the two mobile laboratory units. Phase 1 built out basic functionality on these two platforms for use within one ORA laboratory.,Usable Functionality,2009-12-16,2010-05-14,0.072,0.082,0.082,Completed - Closed,1,02/24/2012,9367,142 days,149 days,0 days
2168,287489: LIMS Proof of Concept Phase 2,Phase 2 expands on the work of phase 1 to build out all of the forms needed to collect the data that currently goes on a 431 form. This includes basic user login and a database at the single ORA laboratory where this was tested.,Usable Functionality,2010-05-10,2010-10-22,0.125,0.108,0.108,Completed - Closed,1,02/24/2012,9368,165 days,160 days,5 days
2168,287489: LIMS Proof of Concept Phase 3,Phase 3 focused on analyzing and testing approaches to aggregating data collected from multiple laboratory sites so that it could be automatically picked up and fed back into MARCS FACTS.,Key Deliverable,2010-10-25,2011-04-07,0.05,0.043,0.043,Completed - Closed,1,02/24/2012,9369,164 days,164 days,0 days
