2605,JPES Framework,"Develop V1.2, DVL SOAP-based web services, Permissions management for JOPES and generic JPES applications, Initial ABAC capability. In July 2012 Deploy V1.3,DVL integration with IGS, DVL integration with RTB,extended ABAC support.",Usable Functionality,2011-09-02,2012-09-01,7.207,7.207,In-progress,1,07/20/2012,11161,365 days,,0 days
2605,Integrated Gaming System,"Develop Capability Package 1 & Capability Package 2 in FY12,Joint rapid adjudication enhancements for unit posture and weapon system ranges, Mass Unit Editing, Enhanced Joint Tasking(Attack, Defend, etc),UI usability enhancements and resolution of Map Wrap defect that splits PACOM AOR,Asynchronous  rehearsal,Migration of Sensing  Algorithm, Data on demand to improve usability of save and load CFDB Planning and Design,Integration with JFW/DVL for JOPES reference data.",Usable Functionality,2011-03-29,2012-03-28,11.091,11.091,Completed - Closed,1,07/20/2012,11162,365 days,365 days,0 days
2605,Rapid TPFDD Build,"Develop v1.1 to include, Integration with JFW/DVL for JOPES reference data Force Flow Manager enhancements to include :Improved sealift, Conus -to- Conus moves, Date generation fixes,  JFAST integration with web service, ILOC enhancements, UI Improvements,Mass query/edit capability.",Usable Functionality,2011-07-01,2012-06-30,11.989,11.989,Completed - Closed,1,07/20/2012,11163,365 days,273 days,0 days
2605,JCRM,"JCRM is being transitioned to DISA in two parts, First part in December 2011, Second Part in June 2012. Development will cover enhancements required in 4QFY12.",Usable Functionality,2011-12-01,2012-09-28,2.7,2.7,In-progress,1,07/20/2012,11164,284 days,,-59 days
2606,GCSS-J; Increment 7; v7.3; v7.3.1; v7.3.2,"This version will complete the architectural transition.  The key elements of the transition are the incorporation of JBOSS and FLEX into the architecture.  These Open Source software products improve system performance by allowing the end user to pull the data once and manipulate that data in their browser, thus eliminating the processing time between the application and authoritative data sources, which is significant when the data source is a legacy system.   Additionally, the new architecture reduces the footprint and increases the scalability of the servers.  This release will support the development of web services for the National Level Ammunition Capability (NLAC) (i. e., enhance munitions logistics planning and management by supporting the Joint Ammunition Community, including ammunition users, managers, and planners throughout the Department of Defense), the Fuels Automated System (FAS) FAS Enterprise Server (FES), and WebREPOL; create new WatchBoards; include Google Earth functionality and capabilities (i.e., provide the ability to render geographically tagged report data, map layers, and WatchBoards in a format that can be consumed and displayed by the Google Earth clients);  and begin the initial Intra-Theatre Distribution capability on the NIPRNet.Key Deliverable/Usable Functionality:  Test, deploy, and maintain NIPRNet/SIPRNet capabilities based upon the Combatant Command 129 Requirements and Capability Development Document as approved and prioritized by the functional sponsor, Joint Staff J4.  All of these requirements and goals are translated into releases with specific capabilities, which have established cost, schedule, and performance parameters approved by the DISA's Component Acquisition Executive/Milestone Decision Authority.  Will support the development of web services for NLAC, FES, and WebREPOL; create new WatchBoards; include Google Earth functionality and capabilities (i.e., provide the ability to render geographically tagged report data, map layers, and WatchBoards in a format that can be consumed and displayed by the Google Earth client); and begin the initial Distribution capability on the NIPRNet.  Additionally, will support the development of the Logistics Capability Planning Tool effort.",Usable Functionality,2011-02-02,2012-11-08,39.71,39.71,In-progress,1,07/20/2012,11165,645 days,,0 days
2607,GDSS v2.3.2,"Field version update; technology refresh with 64-bit environment, Storage Area Network (SAN) and replication agent upgrade.",Usable Functionality,2010-09-27,2011-12-15,3.442,1.916,Completed - Closed,1,03/15/2012,11166,382 days,444 days,0 days
2607,GDSS v2.3.3,Test and field version update; DOD-mandated Common Access Card (CAC) enabling and Transportation Tracking Account Number (TTAN).,Usable Functionality,2011-04-08,2012-02-29,2.295,1.782,In-progress,1,03/15/2012,11167,237 days,,0 days
2607,GDSS v2.3.4,"Develop, test, and field version update; provides 25 user change requests; functional enhancements and software fixes to improve usability and reliability.",Usable Functionality,2011-08-01,2012-06-20,1.228,1.228,In-progress,1,03/15/2012,11168,324 days,,0 days
2607,GDSS v3.0,"Develop, test, and field version update; technical refresh with DOD-directed SHA-256 and upgrade to Oracle 11G 64-bit environment; Thin Client migration Phase 1 -technical release to upgrade COTS products to mainstream versions.",Usable Functionality,2011-08-01,2012-10-31,1.411,1.411,In-progress,1,03/15/2012,11169,457 days,,0 days
2607,GDSS Enterprise Services Monitoring (ESM) v2.2,"Develop, test, and field version update; update monitoring capabilities of currently fielded C2 system and provide enhanced monitoring capabilities.",Usable Functionality,2010-09-15,2011-10-14,3.729,1.7,Completed - Closed,1,03/15/2012,11171,394 days,394 days,0 days
2607,GDSS ESM V2.3,"Develop, test, and field version update; Update monitoring capabilities of currently fielded C2 system and provide enhanced monitoring capabilities.",Usable Functionality,2011-04-22,2011-10-14,1.721,1.059,Completed - Closed,1,03/15/2012,11172,175 days,175 days,0 days
2607,GDSS XSG Phase 2,Engineer and field security solution; Provide and install 15 XML firewall devices and associated engineering to implement.,Usable Functionality,2010-10-01,2011-09-30,1.75,1.75,Completed - Closed,1,03/15/2012,11173,364 days,364 days,0 days
2607,GDSS HBSS v3.0 and SPLUNK Phase 2,Engineer and field security solution; Provide and install hardware solution (40 servers) and associated engineering to implement.,Usable Functionality,2011-09-30,2012-09-30,1.368,1.368,In-progress,1,03/15/2012,11174,366 days,,0 days
2608,AvORM v2.0,"(formerly identified as v2.7)  Develop, test, and field version updates.  Aviation Operational Risk Management - Development of an automated predictive analysis tool to identify, assess, and mitigate risk of daily MAF operations.",Usable Functionality,2011-01-03,2011-12-15,1.553,1.688,Completed - Closed,1,03/15/2012,11175,316 days,346 days,0 days
2609,GAS Agile project identification,Provide an agile release with GAS user stories coupled with a cohesive plan and schedule for software developer team execution.,Key Deliverable,2011-04-01,2011-09-30,4.788,3.236,Completed - Closed,1,03/15/2012,11176,335 days,182 days,0 days
2609,GAS Technical Prototype,GAS technical review of key/critical Information Technology capabilities to review new technologies.,Key Deliverable,2011-10-30,2012-06-30,2.327,2.327,In-progress,1,03/15/2012,11177,244 days,,0 days
2610,GAM Agile Project Identification,Provide an agile release train with GAM user stories coupled with a cohesive plan and schedule for software developer team execution.,Key Deliverable,2011-04-01,2011-09-30,5.868,4.641,Completed - Closed,1,03/15/2012,11179,335 days,182 days,0 days
2610,GAM Technical Prototype,GAM technical review of key/critical Information Technology capabilities to review new technologies.,Key Deliverable,2011-10-30,2012-06-30,3.606,3.606,In-progress,1,03/15/2012,11180,244 days,,0 days
2611,DMR Agile project identification,Provide an agile release train with DMR user stories coupled with a cohesive plan and schedule for software developer team execution.,Key Deliverable,2011-04-01,2011-09-30,8.43,6.668,Completed - Closed,1,03/15/2012,11182,335 days,182 days,0 days
2611,DMR Technical Prototype,DMR technical review of key/critical Information Technology capabilities to review new technologies.,Key Deliverable,2011-10-30,2012-06-30,5.127,5.127,In-progress,1,03/15/2012,11183,244 days,,0 days
2612,Pre-Engineering Manufacturing Development (EMD) Review,"Contracting activities to support the EMD acquisition phase post Milestone-B (MS-B) to include Request For Proposal (RFP) development, Independent Government Cost Estimate (IGCE) and market research.  Included in this review will be the status of BEC MS-B documentation, the draft RFP, contracting documents and schedule.",Key Deliverable,2011-07-01,2012-10-01,5.856,7.32,In-progress,1,02/29/2012,11185,365 days,,0 days
2612,Complete all applicable statutory and regulatory program documentation associated with Milestone-B (MS-B),During this activity all applicable program documentation will be completed and approved by the appropriate authority.  The EMD source selection will be completed and integrated costs will be verified by industry (proposals).,Key Deliverable,2011-05-01,2013-06-29,13.664,18.056,In-progress,1,02/29/2012,11186,610 days,,0 days
2613,Architecture Framework,"Complete full draft of Department of Defense Architecture Framework (DODAF) architecture.  Define system functionality and interface requirements, prepare preliminary and detail designs including emphasis on form factor, assess existing system maturity, perform test and evaluation activities, examine deployment sustainaility, sutiability, and survivaility plans for FY2014 deployment.",,2011-10-01,2013-02-14,28.74,28.74,In-progress,1,02/29/2012,11187,502 days,,0 days
2622,Interface Prototype:Integration of single Web based interface engine to ensure the number of separate interfaces is minimized.,Interface results from non-clinical lab systems into DOEHRS-IH and share Food and Water information with other agencies.,Usable Functionality,2012-01-31,2013-06-01,4.1,4.1,In-progress,1,07/20/2012,11196,487 days,,-123 days
2622,"Data Warehouse Enhancements: Expands the Data Warehouse to include Environmental Health, Ventilation & Radiation",Ability to do corporate reporting on additional survey areas.,Usable Functionality,2012-01-31,2013-06-01,3.526,3.526,In-progress,1,07/20/2012,11197,487 days,,-123 days
2622,Prototyping Exposure Characterizations,Expansion of system to incorporate additional methods for functionality to minimize the impact of worksite hazards & facilitates readiness.,Usable Functionality,2012-01-31,2013-06-01,5.564,5.564,In-progress,1,07/20/2012,11198,487 days,,-123 days
2622,Prototyping Food & Water Surveillance,"Supports inspections and assessments of food & drinking water safety, sanitation, & service facilities.  Provides the ability to support Installation Support Plans and multiple types of food and water inspections.",Usable Functionality,2012-01-31,2013-06-01,2.622,2.622,In-progress,1,07/20/2012,11199,487 days,,-123 days
2623,Increment 10.1 - Second of Two Standarization Blocks,Actual LLC is those funds expended to date (87% of Projected Costs).  Increment 10.1 is fully fielded to all 24 sites with continued spiral updates (6-12-18 months) scheduled to maintain currency with Joint Community and security posture. FY12 and beyond approach will depend upon if Modernization Increment 10.2 continues or not.,Usable Functionality,2003-12-15,2012-09-30,754.895,797.0,In-progress,1,03/15/2012,11200,3212 days,,0 days
2624,Increment 10.2 - Modernization,"Current Planned & Projected Completion dates = FOCThe current approved acquisitioni strategy was approved by AT&L, 15 Dec 10.  It calls for a pre-Engineering and Manufactoring Development (EMD) phase prior to Milestone B (current est = 4Q/FY12).  The Modernization contract to accomplish this work is in source selection and is estimated to be awarded 1Qor 2Q/FY12.",Usable Functionality,2007-09-12,2017-09-30,485.476,485.476,In-progress,1,03/15/2012,11201,3671 days,,0 days
2629,"Cost Analysis, testing, Cost Estimates and HW execution plan",Performing analysis on potential replacement servers for current hardware architecture.,Usable Functionality,2011-05-11,2012-09-10,0.6,0.6,In-progress,1,02/29/2012,11207,488 days,,0 days
2636,Spiral 1 Capability A1 Contingency Planning,"Strategic Guidance and support for In-Progress Review A, part 1 of 2 (Mission Analysis and Effects Planning for Operation Plans (OPLANS)/Concept Plans (CONPLANs)).",Usable Functionality,2010-11-30,2012-01-31,2.156,2.156,In-progress,1,03/15/2012,11218,427 days,,0 days
2636,Spiral 1 Capability A2 Crisis Action Planning,"Automated orders writing service, part 1 of 2; Branch/sequel planning and blended COAs, part 1 of 2; COA development updates: phases, forces, analysis, spell check, etc.; Effects Assessment capability via integration of Theater Operation Planning and Assessment Service (TOPAS) Advanced Capability Technology Demonstration (ACTD) capability, phases 1 and 2 of 3.",Usable Functionality,2010-11-30,2012-01-31,2.712,2.712,In-progress,1,03/15/2012,11219,427 days,,0 days
2636,Spiral 1 Capability A3 Leadership Decision Support,Joint User Messaging (JUM) interface necessary to consume future data  as well as support for C2 Battle Management Communications (C2BMC) and Combatant Commanders' Integrated C2 System (CCIC2S) Services for Missile Defense and Warning.,Usable Functionality,2010-11-30,2012-01-31,0.366,0.366,In-progress,1,03/15/2012,11220,427 days,,0 days
2636,Spiral 1 Capability A4 Training,"Training workspace with help-chat, updated quick reference guides, and updated help videos.",Usable Functionality,2010-11-30,2012-01-31,0.778,0.778,In-progress,1,03/15/2012,11221,427 days,,0 days
2636,Spiral 1 Capability A5 Sustainability,"Return to Service, Operational Availability, and Mean Time Between Critical FailuresJoint Worldwide Intelligence Communications System (JWICS) alternate site (Post IOC).",Usable Functionality,2010-11-30,2012-01-31,2.499,2.499,In-progress,1,03/15/2012,11222,427 days,,0 days
2636,Spiral 1 Capability A6 Net Centricity,IA improvements;  Continued transition to the Joint C2 Objective Architecture.,Usable Functionality,2010-11-30,2012-01-31,0.676,0.676,In-progress,1,03/15/2012,11223,427 days,,0 days
2637,Spiral 2 Capability A2 Crisis Action Planning and Effects Based Planning,"Complete support for Strategic Guidance development and the associated IPR A brief, part 2 of 2. Strategic Guidance is 1 of 4 parts required to fully implement C/CP for USSTRATCOM J5; the remainder of this requirement depends on Increment 3. OPLAN/CONPLAN Strategic Guidance/Plan Initiation development (applies to CAP also) (Post IOC); Effects Assessment capability via integration of Theater Operation Planning and Assessment Service (TOPAS) Advanced Capability Technology Demonstration (ACTD) capabilityAutomated orders writing service, part 2 of 2; COA tasks by phase, and in multiple time formats (Post IOC); Blended COAs, part 2 of 2; Branch and sequel planning (Post IOC); Addition of Plan Initiation Module (PIM) to the CAP template structure (Post IOC); Integration of non-military situation development and COA planning  through the Defense Advanced Research Products Agency's (DARPA's) Integrated Crisis Early Warning System (ICEWS); Staff Estimates (Post IOC).",Usable Functionality,2011-06-30,2012-09-30,7.608,7.608,In-progress,1,03/15/2012,11224,458 days,,0 days
2637,Spiral 2 Capability A5 Sustainability,"Return to Service, Operational Availability, and Mean Time Between Critical FailuresJoint Worldwide Intelligence Communications System (JWICS) alternate site (Post IOC).",Usable Functionality,2011-06-30,2012-09-30,0.485,0.485,In-progress,1,03/15/2012,11225,458 days,,0 days
2637,Spiral 2 Capability A6 Net Centricity,IA improvements;  Continued transition to the Joint C2 Objective Architecture.,Usable Functionality,2011-06-30,2012-09-30,0.357,0.357,In-progress,1,03/15/2012,11226,458 days,,0 days
2638,ISPAN Increment 2 Spiral 1 Test Support,"ISPAN Increment 2 Spiral 1 development test support from AFOTEC, JITC and ISPAN Test Program Office personnel to support Increment 2 Spiral 1 development deliveries.",Usable Functionality,2010-10-01,2012-03-31,0.588,0.588,In-progress,1,03/15/2012,11227,547 days,,0 days
2638,Increment 2 Spiral 1 Program Management Support,"Day-to-day management support to the ISPAN Program Manager. This includes costing, support for external reporting, budgeting and program management to support Spiral 1 development.",,2010-10-01,2012-03-31,2.247,2.247,In-progress,1,03/15/2012,11228,547 days,,0 days
2638,ISPAN Increment 2 Spiral 1 Engineering Support,MITRE Engineering Support for ISPAN Increment 2 Spiral 1 development.,,2010-10-01,2012-03-31,0.911,0.911,Completed - Closed,1,03/15/2012,11229,547 days,456 days,0 days
2638,Increment 2 Spiral 2 Engineering Support,MITRE Engineering Support for ISPAN Increment 2 Spiral 2 development.,,2012-04-01,2013-08-31,0.91,0.91,Completed - Closed,1,03/15/2012,11232,517 days,31 days,-123 days
2639,Hardware Alternate Site Capability,"Hardware to support the CIE development environment for the visualization and deployment of the CIE application to alternate site location.  This includes servers, workstations, software licenses, storage array memory, load balancers, etc.Configuring, programming the equipment and software to support the Alternate Site operation.  Actually operating from the alternate site, making it transparent to the user.",Usable Functionality,2010-12-01,2012-05-31,2.932,2.932,In-progress,1,03/15/2012,11233,547 days,,0 days
2641,Special Mission (E-3/E-8) v2.0: CA-MPE Rel,Special Mission (E-3/E-8) v2.0: CA-MPE Rel.,,2011-01-01,2012-05-01,3.755,3.755,In-progress,1,02/29/2012,11236,486 days,,0 days
2641,Special Mission (E-3/E-8) v3.0/v3.1: CA-FQT,Special Mission (E-3/E-8) v3.0/v3.1: CA-FQT.,,2011-10-01,2012-10-01,1.023,1.023,In-progress,1,02/29/2012,11237,366 days,,0 days
2643,JPADS v3.0: CA-FQT,JPADS v3.0: CA-FQT.,,2011-08-01,2012-09-01,2.688,2.688,In-progress,1,02/29/2012,11240,397 days,,0 days
2643,JPADS v3.1: CA-PDR,JPADS v3.1: CA-PDR.,,2011-08-01,2013-02-01,3.456,3.456,In-progress,1,02/29/2012,11242,550 days,,0 days
2644,B-1 Rel 6: CDR-MPE,B-1 Rel 6: CDR-MPE.,,2010-08-01,2011-12-01,4.391,4.391,In-progress,1,02/29/2012,11243,487 days,,0 days
2644,B-1 Rel 7: CDR-MPE Rel,B-1 Rel 7: CDR-MPE Rel.,,2011-10-01,2013-03-01,6.339,6.339,In-progress,1,02/29/2012,11244,517 days,,0 days
2644,F-15 Ste 7 v3.0: FQT-MPE Rel,F-15 Ste 7 v3.0: FQT-MPE Rel.,,2011-04-01,2012-02-01,2.645,2.645,In-progress,1,02/29/2012,11245,306 days,,0 days
2644,F-15 Ste 7 v3.1: FQT-MPE Rel,F-15 Ste 7 v3.1: FQT-MPE Rel.,,2011-10-01,2012-08-01,2.243,2.243,In-progress,1,02/29/2012,11246,305 days,,0 days
2644,F-22 v13.0 (3.2B): CA-CDR,F-22 v13.0 (3.2B): CA-CDR.,,2011-08-01,2013-01-01,5.762,5.762,In-progress,1,02/29/2012,11248,519 days,,0 days
2645,A-10 Ste 7B: CA-MPE Rel,A-10 Ste 7B: CA-MPE Rel.,,2010-02-01,2012-05-12,2.179,2.179,In-progress,1,02/29/2012,11249,831 days,,0 days
2646,F-22 Rel 12 (3.2A): PDR-FQT,F-22 Rel 12 (3.2A): PDR-FQT.,,2011-10-01,2013-03-01,2.262,2.262,In-progress,1,02/29/2012,11250,517 days,,0 days
2647,E-8 MPE V1.0: OT-FDD,E-8 MPE V1.0: OT-FDD.,,2011-07-01,2012-04-01,5.734,5.734,In-progress,1,02/29/2012,11251,275 days,,0 days
2648,A-10 Suite 7A,A-10 Suite 7A.,,2011-06-01,2012-06-01,0.55,0.55,In-progress,1,02/29/2012,11252,366 days,,0 days
2648,B-1 Rel 4 (SB-13),B-1 Rel 4 (SB-13).,,2010-10-01,2011-12-01,0.55,0.55,In-progress,1,02/29/2012,11254,426 days,,0 days
2648,E-3,E-3.,,2011-04-01,2012-09-01,0.97,0.97,In-progress,1,02/29/2012,11256,519 days,,0 days
2648,RC-135,RC-135.,,2011-07-01,2012-12-01,0.395,0.395,In-progress,1,02/29/2012,11258,519 days,,0 days
2648,F-16 Block 30 (SCU 7),F-16 Block 30 (SCU 7).,,2011-02-01,2012-02-01,0.65,0.65,In-progress,1,02/29/2012,11260,365 days,,0 days
2648,F-16 Blk 40/50 M5/M5+,F-16 Blk 40/50 M5/M5+.,,2011-02-01,2012-07-01,0.65,0.65,In-progress,1,02/29/2012,11262,516 days,,0 days
2650,New Equipment training (NET),The NET will train a goup of experienced individuals with varying specialties for initial training on the maintenance and operation WIN-T Inc 2 equipment. Training will be provided to all assigned operators and maintainers of WIN-T Inc 2 that is critical to unit readiness.,,2012-01-09,2012-03-22,12.662,12.662,In-progress,1,03/07/2012,11265,73 days,,-5 days
2650,Cold Region Test,"The testing effort is centered at the Bolio Lake Test Complex, Alaska. A full range of cold weather or temperate climate tests will be conducted.",,2012-01-23,2012-02-17,0.491,0.491,Completed - Closed,1,03/07/2012,11266,25 days,14 days,-19 days
2651,"Joint Command, Control, Communications, Computers, Intelligence, Surveillance, and Reconnaissance (JC4ISR) Radio Development","Develop and integrate the Joint Command, Control, Communications, Computers, Intelligence, Surveillance, and Reconnaissance (JC4ISR) Radio into the WIN-T Inc 3 system.",,2010-10-15,2012-04-15,49.631,49.631,In-progress,1,02/29/2012,11268,548 days,,0 days
2651,"Joint Command, Control, Communications, Computers, Intelligence, Surveillance, and Reconnaissance (JC4ISR) Radio Antenna Development","Develop and integrate the Joint Command, Control, Communications, Computers, Intelligence, Surveillance, and Reconnaissance (JC4ISR) Radio Antenna into the WIN-T Inc 3 system.",,2010-10-15,2012-04-15,88.915,88.915,In-progress,1,02/29/2012,11269,548 days,,0 days
2651,Software Development,Devolop the WIN-T Inc 3 software for integration of the JC4ISR Radio and associated antennas.,,2010-10-15,2012-04-15,38.296,38.296,In-progress,1,02/29/2012,11270,548 days,,0 days
2652,JIPM Technology Refreshment,"The JIPM program fulfills two key requirements concerning Security and Efficiency of bandwidth. The JIPM will use the DVB-S2/RCS open standard waveform and incorporate a method to provide security of transmission data that is approved by the National Security Agency (NSA) and the Assistant Secretary of Defense for Networks and Information Integration (ASD NII). The JIPM supports the Teleport Program Office''s (TPO) overall requirement to supply gateways that employ built-in encryption or TRANSEC across the worldwide Teleport system. Additional capabilities added to JIPM for customers such as Global Broadcast System (GBS) to include data rates, modes of operation (e.g., receive-only), and multi-beam, multi-satellite operation.",Usable Functionality,2011-08-01,2012-09-30,6.1,6.1,In-progress,1,07/20/2012,11271,426 days,,0 days
2652,Linkway S2 Technology Refreshment,"The Linkway S2 refresh is part of a two year Linkway IP modem refresh effort.  The Linkway S2 Tech Refresh will provide the Linkway 2100 fleet with S2 TRANSEC Traffic Terminals (modems), which provide a significant performance and capability improvement from the 2100 modem and 8.3 s/w.  The new modems have much higher throughput capabilities with DVB-S2 encoding supporting up to 10 Msps and have internal TRANSEC.",Usable Functionality,2011-08-01,2012-09-30,1.067,1.067,In-progress,1,07/20/2012,11272,426 days,,0 days
2652,iDirect Technology Refreshment,"*This activity is still going through the Engineering Change Request approval process.  Once it is approved, more information will be provided.The iDirect Tech Refresh effort includes procruring two iDirect iDX2.2 systems for implementation at Fort Buckner and Wahiawa.  Version iDX 2.2 will resolve existing security findings and support increased capability and performance for the warfighter.",Usable Functionality,2011-08-01,2012-10-01,1.4,1.4,In-progress,1,07/20/2012,11273,427 days,,0 days
2653,Northwest Facilities Preparation,Facilities preparation for Northwest includes developing the site requirements package (March - Aug 2011); completing the installation drawing plans (Feb 2011 - Jan 2012); and conducting site preparation (Apr - Oct 2012).,Usable Functionality,2011-03-07,2012-10-19,0.969,0.969,In-progress,1,03/07/2012,11274,592 days,,0 days
2653,Camp Roberts Facilities Preparation,Facilities preparation for Camp Roberts includes developing the site requirements package (March - Nov 2011); completing the installation drawing plans (Mar 2011 - Mar 2012); and conducting site preparation (Apr - Dec 2012).,Usable Functionality,2011-03-11,2012-12-03,0.766,0.766,In-progress,1,03/07/2012,11275,633 days,,0 days
2653,Fort Buckner Facilities Preparation,Facilities preparation for Fort Buckner includes developing the site requirements package (March - Oct 2011); completing the installation drawing plans (Mar 2011 - June 2012); and conducting site preparation (July 2012 - Apr 2013).,Usable Functionality,2011-03-16,2013-04-04,0.792,0.792,In-progress,1,03/07/2012,11276,750 days,,0 days
2653,Wahiawa Facilities Preparation,Facilities preparation for Wahiawa includes developing the site requirements package (March - Aug 2011); completing the installation drawing plans (Mar 2011 - Feb 2012); and conducting site preparation (May 2012 - Feb 2013).,Usable Functionality,2011-03-18,2013-02-04,0.896,0.896,In-progress,1,03/07/2012,11277,689 days,,0 days
2653,Landstuhl Facilities Preparation,Facilities preparation for Landstuhl includes developing the site requirements package (May - Oct 2011); completing the installation drawing plans (Feb 2011 - May 2012); and conducting site preparation (July 2012 - Mar 2013).,Usable Functionality,2011-05-31,2013-03-06,1.074,1.074,In-progress,1,03/07/2012,11278,645 days,,0 days
2653,Lago Facilities Preparation,Facilities preparation for Lago includes developing the site requirements package (Aug - Nov 2011); completing the installation drawing plans (July 2011 - Feb 2012); and conducting site preparation (Aug 2012 - Feb 2013).,Usable Functionality,2011-08-04,2013-02-19,0.766,0.766,In-progress,1,03/07/2012,11279,565 days,,0 days
