686,ASR-8 SLEP - Site prep for St. Thomas,Site preparation for ASR-8 facility at St. Thomas.,Key Deliverable,2011-07-01,2012-09-30,0.165,0.165,In-progress,1,08/23/2012,2834,335 days,,0 days
686,ASR-8 SLEP - Site prep for San Juan,Site preparation for ASR-8 facility at San Juan.,Key Deliverable,2011-07-01,2012-09-30,0.165,0.165,In-progress,1,08/23/2012,2835,335 days,,0 days
688,Electronic File System-Application (EFS-A) - Production Support and Maintenance through CY2011,"Develop hot fixes and minor enhancements to the core application, including machine APIs and user interfaces to support the Electronic File System, which will be the primary repository for documents supporting the AIR Safety Workforce business processes and analysis. The system will enable document storage, cataloging, indexing, retrieval, and disposition, conversion of existing paper files to electronic files (historical scanning), and access to historical documents supporting current certification and inspection decisions and analysis.",,2011-08-15,2011-12-31,0.3,0.29,Completed - Costs Pending,1,08/23/2012,2839,138 days,138 days,0 days
688,Electronic File System-Application (EFS-A) - Production Support and Maintenance through May 2012,"Develop hot fixes and minor enhancements to the core application, including machine APIs and user interfaces to support the Electronic File System, which will be the primary repository for documents supporting the AIR Safety Workforce business processes and analysis. The system will enable document storage, cataloging, indexing, retrieval, and disposition, conversion of existing paper files to electronic files (historical scanning), and access to historical documents supporting current certification and inspection decisions and analysis.",,2012-01-01,2012-06-15,0.3,0.1,In-progress,1,08/23/2012,2840,151 days,,0 days
688,Electronic File System-Application (EFS-A) - Phase 3 - Requirements/Design Review with new vendor,"Transition to a new vendor and complete requirements gathering and analysis for Phase 3, which includes new administrative functionality for the Electronic File System, which will be the primary repository for documents supporting the AIR Safety Workforce business processes and analysis. The system will enable document storage, cataloging, indexing, retrieval, and disposition, conversion of existing paper files to electronic files (historical scanning), and access to historical documents supporting current certification and inspection decisions and analysis.",,2011-08-29,2012-05-31,0.3,0.403,Completed - Costs Pending,1,08/23/2012,2841,124 days,212 days,64 days
688,Electronic File System-Historical Scanning (EFS-H) - Scan documents from Phase 1A Sites,"Scan AIR's historical paper documents from phase 1A sites for storage and hosting in the Electronic File System, which will be the primary repository for documents supporting the AIR Safety Workforce business processes and analysis. The system will enable document storage, cataloging, indexing, retrieval, and disposition, conversion of existing paper files to electronic files (historical scanning), and access to historical documents supporting current certification and inspection decisions and analysis.",,2011-07-01,2012-09-30,0.33,0.689,In-progress,1,08/23/2012,2843,183 days,,0 days
689,"MSRD - Internal Oversee Safety Process (OSPi) - Development, Test, and Deployment of Code for Release 1 (Performance) Phases 1 &amp; 2 (R1P1-R1P2)","Develop, test, and deploy code for Release 1, Phases 1 &amp; 2, of OSP. Release 1 focuses on Performance data, with phases 1 &amp; 2 providing the core framework components. OSP will monitor the health of the AIR system, enable OSP Management Review Board to make recommendations aimed at improving system performance and reducing system risks, and enable AIR to collect meaningful safety data (Accident, Service Difficulty, Audit, Process, Safety Performance Framework, Safety Risk Hazard, and Organizational data) for the AIR Safety Management System (SMS).",,2010-08-17,2012-07-15,0.5,0.5,In-progress,1,08/23/2012,2846,90 days,,202 days
690,"Designee Supervision / Past Performance (DS/PP) - Development of functionality for designee types DMIR, DAR-T, &amp; DAR-F","Develop code to support functionality required for AIR designee types DMIR, DAR-T, and DAR-F. DS/PP is the ASKME/AIR portion of the larger AVS Designee Management System (DMS) initiative, which will automate designee processes related to orientation, training, oversight, and reporting.",,2009-07-27,2012-12-31,0.431,0.357,In-progress,1,08/23/2012,2850,90 days,,766 days
691,Assimilate Lessons Learned (ALL) - Development,"Develop, test, and deploy code for ALL, which provides the applications necessary to capture lessons learned knowledge - gathered during the certification and production approval process, regulatory development functions, and continued operational safety functions - and then share the knowledge across AIR.",Usable Functionality,2011-09-01,2012-09-10,0.979,0.942,In-progress,1,08/23/2012,2852,211 days,,-22 days
692,WTS - Work Activity Tracking (WAT) - Design Part 2 - Critical Design Review (CDR),"Complete the Critical Design Review for WAT, which provides the applications necessary to allow detailed tracking of all work activities to facilitate resource optimization within AIR.",,2011-06-13,2011-10-31,1.312,1.044,Completed - Costs Pending,1,08/23/2012,2853,137 days,140 days,0 days
692,WTS - Work Activity Tracking (WAT) - Development of core components and architecture,"Develop core components and architecture for WAT, which provides the applications necessary to allow detailed tracking of all work activities to facilitate resource optimization within the AIR.",,2011-10-31,2013-02-04,3.0,3.237,In-progress,1,08/23/2012,2854,152 days,,1 days
693,Engineering Design Approval (EDA) - Requirements,"Complete the System Requirements Review (SRR) for EDA, which will provide a single, integrated system to accomplish engineering design approvals according to the certification process and safety management principles.",,2011-03-07,2011-10-31,0.777,0.595,Completed - Costs Pending,1,08/23/2012,2856,220 days,272 days,-34 days
693,Engineering Design Approval (EDA) - Design - Preliminary Design Review (PDR),"Complete the Preliminary Design Review (PDR) for EDA, which will provide a single, integrated system to accomplish engineering design approvals according to the certification process and safety management principles.",,2011-10-14,2012-03-23,0.2,0.441,Completed - Costs Pending,1,08/23/2012,2857,78 days,143 days,18 days
693,Engineering Design Approval (EDA) - Design - Critical Design Review (CDR),"Complete the Critical Design Review (CDR) for EDA, which will provide a single, integrated system to accomplish engineering design approvals according to the certification process and safety management principles.",,2012-01-01,2012-06-30,0.279,0.321,In-progress,1,08/23/2012,2858,166 days,,85 days
694,DTE - DDS Technical Evaluations Aircraft Certification Audit Info System (ACAIS) - Requirements,"Complete the System Requirements Review (SRR) for DTE-DDS (ACAIS), which provides Aircraft Certification Service (AIR) and Flight Standards Service (AFS) with the ability to schedule, plan, document, and analyze the results of evaluations, inspections, and audits, and supervise FAA Production Approval Holders (PAHs) and Organizational Designation Authorizations (ODAs).",,2011-03-07,2011-10-31,0.903,0.658,Completed - Costs Pending,1,08/23/2012,2860,238 days,258 days,-20 days
694,DTE - DDS Technical Evaluations Aircraft Certification Audit Info System (ACAIS) - Design - Preliminary Design Review (PDR),"Complete the Preliminary Design Review (PDR) for DTE-DDS (ACAIS), which provides Aircraft Certification Service (AIR) and Flight Standards Service (AFS) with the ability to schedule, plan, document, and analyze the results of evaluations, inspections, and audits, and supervise FAA Production Approval Holders (PAHs) and Organizational Designation Authorizations (ODAs).",,2011-11-01,2012-03-23,1.0,0.572,Completed - Costs Pending,1,08/23/2012,2861,181 days,143 days,0 days
694,DTE - DDS Technical Evaluations Aircraft Certification Audit Info System (ACAIS) - Design - Critical Design Review (CDR),"Complete the Critical Design Review (CDR) for DTE-DDS (ACAIS), which provides Aircraft Certification Service (AIR) and Flight Standards Service (AFS) with the ability to schedule, plan, document, and analyze the results of evaluations, inspections, and audits, and supervise FAA Production Approval Holders (PAHs) and Organizational Designation Authorizations (ODAs).",,2012-05-01,2012-06-30,1.018,0.338,In-progress,1,08/23/2012,2862,196 days,,-36 days
695,Mobility - Develop Requirements Definition for Personal Computers,Requirements Definition for Personal Computers developed.,Key Deliverable,2011-10-03,2012-06-29,0.38908000000000004,0.33908,Completed - Costs Pending,1,08/23/2012,2865,204 days,179 days,0 days
695,Mobility - Execute Procurement and Deployment for Personal Computers (APB Milestone),Personal Computers procured and deployed.,Key Deliverable,2012-04-25,2012-09-28,3.18665,3.18665,In-progress,1,08/23/2012,2866,156 days,,0 days
696,Mobility - Develop Requirements Definition for Other Peripheral Devices,"Requirements Definition for Other Peripheral Devices developed, Test Devices procured and Device(s) accepted for procurement.",Key Deliverable,2012-01-03,2012-10-29,0.369186,0.354186,Completed - Costs Pending,1,08/23/2012,2867,269 days,118 days,0 days
696,Mobility - Execute Procurement and Deployment for Other Peripheral Devices,Other Peripheral Devices procured and deployed.,Key Deliverable,2012-03-15,2012-09-28,0.785338,0.785338,In-progress,1,08/23/2012,2868,197 days,,41 days
696,Mobility - Develop Requirements Definition for External Hard Drives,"Requirements Definition for External Hard Drives developed, Test Devices procured and Device(s) accepted for procurement.",Key Deliverable,2012-01-03,2012-07-06,0.35408,0.33908,Completed - Costs Pending,1,08/23/2012,2869,185 days,87 days,0 days
696,Mobility - Execute Procurement and Deployment for External Hard Drives,External Hard Drives procured and deployed.,Key Deliverable,2012-03-15,2012-09-28,0.131072,0.131072,In-progress,1,08/23/2012,2870,197 days,,12 days
696,Mobility - Develop Requirements Definition for New Technology,Requirements Definition for New Technology developed.,Key Deliverable,2011-10-03,2012-02-13,0.015804,0.015804,Completed - Costs Pending,1,08/23/2012,2871,88 days,149 days,0 days
696,Mobility - Execute Procurement and Deployment for New Technology,New Technology procured and deployed.,Key Deliverable,2012-01-03,2012-11-09,0.065804,0.015804,Completed - Costs Pending,1,08/23/2012,2872,269 days,28 days,29 days
697,Enterprise Data Center - Storage Area Network Implementation - Host Migration,Implementation and Host Migration for the storage area network.,Key Deliverable,2011-11-03,2012-03-27,0.086525,0.086525,Completed - Costs Pending,1,08/23/2012,2873,160 days,95 days,18 days
697,Enterprise Data Center - Storage Area Network Retirement,Retirement of storage area network.,Key Deliverable,2012-04-12,2012-08-02,0.041712,0.041712,In-progress,1,08/23/2012,2874,187 days,,-38 days
697,Enterprise Data Center - Storage Area Network technical center servers Implementation,Implementation of storage area network technical center servers.,Key Deliverable,2012-01-03,2012-06-29,0.038271,0.6373439999999999,In-progress,1,08/23/2012,2875,98 days,,16 days
697,Enterprise Data Center - Redundant Core Requirements,Solution Requirements.,Key Deliverable,2012-01-03,2012-07-31,0.03465,0.03465,Completed - Costs Pending,1,08/23/2012,2876,204 days,99 days,43 days
697,Enterprise Data Center - Redundant Core Acquisitions (APB Milestone),"Procurement Documentation, Redundant Core Purchased.",Key Deliverable,2012-07-26,2012-08-01,1.4171120000000001,1.3523120000000002,In-progress,1,08/23/2012,2877,64 days,,-227 days
697,Enterprise Data Center - Redundant Core Implementation,"Redundant Core Installed, Redundant Core Configured, Redundant Core Tested.",Key Deliverable,2012-07-26,2012-08-28,0.054871,0.054871,In-progress,1,08/23/2012,2878,202 days,,-190 days
698,Enterprise Data Center - Data Center Redesign,Redesign of the Data Center.,Key Deliverable,2011-10-03,2012-08-28,1.061393,1.0323120000000001,In-progress,1,08/23/2012,2879,112 days,,0 days
698,Enterprise Data Center - Avamar Project Acquisitions &amp; Implementation,Acquisition stage for the Avamar project. Implementation stage for the Avamar project.,Key Deliverable,2011-12-14,2012-10-31,2.120575,2.038481,In-progress,1,08/23/2012,2881,314 days,,-14 days
700,Enterprise Data Center - 8.2 Unisys E-Workflow and Imaging Planning &amp; Acquisition,Planning stage for the upgrade the Registry Modernization System document imaging systems to the newest version of Unisys E-Workflow and Imaging Acquisition stage for the upgrade the Registry Modernization System document imaging systems to the newest version of Unisys E-Workflow and Imaging.,Key Deliverable,2011-12-05,2012-03-16,0.216919,0.216761,Completed - Costs Pending,1,08/23/2012,2884,86 days,71 days,-5 days
700,Enterprise Data Center - 8.2 Unisys E-Workflow and Imaging Implementation,Implementation stage for the upgrade the Registry Modernization System document imaging systems to the newest version of Unisys E-Workflow and Imaging.,Key Deliverable,2012-03-01,2012-10-01,0.078784,0.078784,In-progress,1,08/23/2012,2885,244 days,,42 days
700,Enterprise Data Center - Double Take Planning,Planning stage with a goal to provide a local continuance of operation for the Registry Modernization System document imaging system.,Key Deliverable,2012-01-11,2012-02-13,0.0072900000000000005,0.0072900000000000005,Completed - Costs Pending,1,08/23/2012,2886,22 days,8 days,12 days
700,Enterprise Data Center - Double Take Analysis,Analysis stage with a goal to provide a local continuance of operation for the Registry Modernization System document imaging system.,Key Deliverable,2012-02-03,2012-05-01,0.025561,0.025561,Completed - Costs Pending,1,08/23/2012,2887,77 days,8 days,-11 days
700,Enterprise Data Center - Double Take Acquisition,"Acquisition stage for the acquisition of physical servers, acquisition of the Double-Take software and licensing.",Key Deliverable,2012-04-23,2012-06-26,0.104671,0.035741,Completed - Costs Pending,1,08/23/2012,2888,189 days,44 days,-82 days
700,Enterprise Data Center - Double Take Implementation,"Implementation stage to include VMWare ESX cluster build-out with physical servers, storage area network storage build-out, installation/configuration of the Double-Take console virtual server, and deployment of the Double-Take agents to the Unisys E-Workflow and Imaging 8.2 servers.",Key Deliverable,2012-04-23,2012-07-20,0.044206,0.033020999999999995,In-progress,1,08/23/2012,2889,324 days,,-21 days
700,Enterprise Data Center - Registry Consolidation Planning,Planning stage for the migration of all Registry systems to the Airman Record Building enterprise data center.,Key Deliverable,2012-05-21,2012-06-27,0.012301000000000001,0.012301000000000001,In-progress,1,08/23/2012,2890,37 days,,0 days
700,Enterprise Data Center - Registry Technical Center Servers Acquisitions &amp; Implementation,"Acquisition stage including the acquisition of physical servers, acquisition of RecoverPoint licensing, server build-out, and storage area network storage build-out. Implementation stage for the disaster recovery solution for the Registry Modernization System document imaging system.",Key Deliverable,2012-01-10,2012-04-25,0.14298,0.100365,Completed - Costs Pending,1,08/23/2012,2892,70 days,39 days,62 days
700,Enterprise Data Center - Registry Storage Manager Planning,Planning stage for the Registry Storage Manager project.,Key Deliverable,2011-11-02,2011-11-22,0.006379,0.006379,Completed - Closed,1,08/23/2012,2893,20 days,0 days,0 days
700,Enterprise Data Center - Registry Storage Manager Design,Design stage for the Registry Storage Manager project.,Key Deliverable,2011-12-07,2012-04-10,0.001139,0.001139,Completed - Closed,1,08/23/2012,2894,125 days,1 days,-20 days
700,Enterprise Data Center - Registry Storage Manager Acquisition,Acquisition stage for the Registry Storage Manager project.,Key Deliverable,2011-12-08,2012-11-08,1.203417,1.2113049999999999,In-progress,1,08/23/2012,2895,193 days,,28 days
701,"Service Oriented Architecture - Workflow Services Acquisition, Integration, Test and Deployment","Statement of Work, Implementation Plan, &amp; Governance Test Plan. On Sandbox, Development, Test and Production Environments, software loaded on Server, hardware and software configured, &amp; Web Services Description Language Loaded into the service oriented architecture Registry. On Sandbox, Development and Test Environments, perform test, remediation, certification, accreditation and training. On Production Environment, load and configure software and Web Services Description Language loaded into the service oriented architecture Registry. Acceptance Tested (Production).",Key Deliverable,2011-10-03,2012-08-17,0.023676,0.262498,In-progress,1,08/23/2012,2896,148 days,,14 days
701,"Service Oriented Architecture - Business Rules Service Integration, Test and Deployment","On Sandbox, Development, Test and Production Environments, load and configure software on server and Web Services Description Language loaded into the service oriented architecture Registry. On Sandbox, Development and Test Environments, perform test, remediation, certification, accreditation and training. On Production Environment, load and configure software and Web Services Description Language loaded into the service oriented architecture Registry. Acceptance Tested (Production).",Key Deliverable,2012-02-29,2012-09-20,0.018675,0.018675,In-progress,1,08/23/2012,2897,124 days,,0 days
701,"Service Oriented Architecture - Business Intelligence Services Integration, Test, and Deployment","On Sandbox, Development, Test and Production Environments, software loaded on Server, hardware &amp; software configured &amp; Web Services Description Language Loaded into the service oriented architecture Registry. On Sandbox, Development and Test Environments, perform test, remediation, certification, accreditation and training. On Production Environment, load and configure software and Web Services Description Language loaded into the service oriented architecture Registry. Acceptance Tested (Production).",Key Deliverable,2012-02-03,2012-05-04,0.018675,0.018675,Completed - Costs Pending,1,08/23/2012,2898,74 days,87 days,0 days
702,Server Consolidation - Planning and Testing for Domain Controllers,"Virtual Test Lab built, Infrastructure tested, Applications Programmers testing performed, &amp; Health Check with Microsoft performed.",Key Deliverable,2011-12-01,2012-08-31,0.090057,0.090057,In-progress,1,08/23/2012,2900,186 days,,0 days
702,Server Consolidation - Purchase of Servers,Servers and Storage Devices purchased.,Key Deliverable,2012-04-02,2012-05-04,0.028,0.023105,Completed - Costs Pending,1,08/23/2012,2902,176 days,17 days,11 days
702,Server Consolidation - Purchase of Operations Supplies and Equipment,Operations Supplies and Equipment purchased.,Key Deliverable,2011-10-03,2012-09-28,0.04,0.04,In-progress,1,08/23/2012,2904,361 days,,59 days
704,Telecommunications - Requirements Analysis and Phase 1- 3 Switch Procurements,"Review, update and finalize Aviation Safety_Field_Switch List. Procure and receive switches for Phase 1-3.",Key Deliverable,2011-10-03,2012-04-19,0.5015109999999999,0.474058,Completed - Costs Pending,1,08/23/2012,2906,193 days,190 days,8 days
704,Telecommunications - Phase 1 - 3 Switch Implementation,Implement 27 local area network Switches (Phase 1). Implement 20 local area network Switches (Phase 2). Implement 15 local area network Switches (Phase 3).,Key Deliverable,2012-01-11,2012-09-28,0.01,0.01,In-progress,1,08/23/2012,2907,237 days,,7 days
704,Telecommunications - WLN Desktop Switches - New Acquisitions,Acquisition of new desktop switches.,Key Deliverable,2011-10-03,2012-09-28,0.014519999999999998,0.010381999999999999,In-progress,1,08/23/2012,2908,361 days,,0 days
704,Telecommunications - WLN New Requirement Local Area Network Switches,New requirements of local area network switches.,Key Deliverable,2012-01-03,2012-09-28,0.292169,0.122547,In-progress,1,08/23/2012,2909,269 days,,0 days
704,Telecommunications - WLN Wiring Requirements Definition,Definition of wiring requirements.,Key Deliverable,2011-10-03,2011-12-02,0.004917,0.004917,Completed - Closed,1,08/23/2012,2910,29 days,61 days,9 days
704,Telecommunications - WLN Wiring - Technical Refresh for Existing Sites,Local area network wiring that needs to be replaced on a 10 year lifecycle at local aviation safety facilities. It is the medium that data is transmitted from computer to switch (to wide area network).,Key Deliverable,2012-01-03,2012-09-28,1.1695870000000002,1.166584,In-progress,1,08/23/2012,2911,269 days,,-49 days
705,"Telecommunications - Virtual Private Network Requirements and Procurement. Analysis, New Hardware, and New Software &amp; Licensing","Requirements analysis for Virtual Private Network portal. Virtual Private Network portal is the vehicle by which remote Aviation Safety users connect to the Federal Aviation Administration Telecommunications Infrastructure wide area network. It consists of routers, switches, and other Virtual Private Network software, hardware, and licenses. Virtual Private Network portal procurement consists of routers, switches, and other Virtual Private Network software, hardware, and licenses. Software renewals to support existing equip for Virtual Private Network including yearly maintenance for Juniper firewalls.",Key Deliverable,2011-11-01,2012-09-28,0.098788,0.098788,In-progress,1,08/23/2012,2912,332 days,,49 days
706,Training - Provide Training for Aviation Safety employees on Standard 3.0 Client,"Office of quality, integration and executive services 200 Computer Specialists training and Aviation Safety Workforce for Standard 3.0 Client training deployed.",Key Deliverable,2011-10-03,2012-07-31,0.188531,0.188531,Completed - Costs Pending,1,08/23/2012,2914,211 days,241 days,0 days
706,Training - Create Computer Based Training Modules,Computer Based Training Modules created.,Key Deliverable,2011-12-01,2012-09-13,0.10474000000000001,0.10474000000000001,In-progress,1,08/23/2012,2915,152 days,,138 days
707,Training - Provide Training for Aviation Safety employees on Aviation Safety Mobile Toolkit Technologies,Training Materials for Aviation Safety Mobile Toolkit Technologies developed and Aviation Safety workforce training for Mobile Toolkit Technologies deployed.,Key Deliverable,2011-10-03,2012-09-28,0.237042,0.237042,In-progress,1,08/23/2012,2917,240 days,,0 days
708,Training - Purchase Upgrade for Adobe e-Learning Suite and Training Materials for Field Offices,Upgraded Adobe e-Learning Suite purchased and procured training materials for field offices that will be used in development and production of training materials for Aviation Safety workforce employees.,Key Deliverable,2011-10-03,2012-09-28,0.107841,0.018034,In-progress,1,08/23/2012,2920,361 days,,0 days
708,Training - Training for Trainers,Training for Adobe e-Learning Suite attended &amp; Training for the Virtual Environment attended.,Key Deliverable,2011-12-01,2012-09-14,0.097183,0.080604,In-progress,1,08/23/2012,2921,148 days,,5 days
709,Printers - Provide New Printers and replace old/non-compatible printers,New printers provided to new hires and old/non-compatible printers replaced.,Key Deliverable,2011-10-03,2012-09-28,0.400654,0.331368,In-progress,1,08/23/2012,2922,361 days,,0 days
710,Commercial Off the Shelf Software - Microsoft Enterprise Licensing Agreement True-up,Required enterprise licensing agreement True-up Invoice received.,Key Deliverable,2012-02-01,2012-06-14,0.094825,0.094825,In-progress,1,08/23/2012,2923,98 days,,0 days
711,Service Oriented Architecture,Service Oriented Architecture Deployment 3 - Integrate additional Commercial Off the Shelf Service Oriented Architecture services to align with Federal Enterprise Architecture Framework and generate efficiency in Aviation Safety application development.,Key Deliverable,2009-10-01,2012-05-04,3.831,3.897,Completed - Costs Pending,1,08/23/2012,2924,607 days,945 days,-3 days
711,Data Architecture Framework,Data Architecture Framework Deployment 4 - Enhance Data Architecture Framework to account for new application development efforts by other non-RCISS initiatives.,Key Deliverable,2010-12-01,2011-12-12,0.03,0.413,Completed - Closed,1,08/23/2012,2925,303 days,352 days,33 days
711,Service Oriented Architecture ,Service Oriented Architecture Deployment 4 - Integrate additional Commercial Off the Shelf Service Oriented Architecture services to align with Federal Enterprise Architecture Framework and generate efficiency in Aviation Safety application development.,Key Deliverable,2011-05-02,2012-04-09,0.787,0.806,Completed - Costs Pending,1,08/23/2012,2926,151 days,343 days,0 days
711,Server Consolidation,Server Consolidation Deployment 4 - Deploy final 25% of server infrastructure solution.,Key Deliverable,2010-12-01,2011-11-30,0.693,0.683,Completed - Closed,1,08/23/2012,2927,303 days,364 days,0 days
711,Telecommunications,"Telecommunications Deployment 4 - Enhance and modernize wide area network, local area network and Virtual Private Network infrastructure for Aviation Safety.",Key Deliverable,2010-10-01,2011-09-30,0.7,1.223,Completed - Closed,1,08/23/2012,2928,364 days,364 days,0 days
711,Training,Training Deployment 4 - Develop and procure training for new technologies deployed by RCISS for Aviation Safety workforce.,Key Deliverable,2011-04-01,2012-05-11,1.222,1.199,Completed - Costs Pending,1,08/23/2012,2929,182 days,343 days,21 days
